{
  "schema": 1, "trainee_id": "T1", "session_id": "3f6c1e9a-0b7d-4a51-9a52-0c3c0d2f8e11",
  "accepted": 0, "dropped": 0, "state": "GREEN", "state_since": 1791700120000,
  "calibration_remaining_s": 0, "hr_now": 88, "hr0": 74, "core_est_c": 37.12, "core_band_c": 0.6,
  "psi": 0.7, "minutes_to_red": null, "env": null,
  "advice": {"en": "Strain low. Keep drinking water.", "hi": "तनाव कम है। पानी पीते रहें।"},
  "alert": "NONE", "incident_id": null, "server_time": 1791700180000
}
